{
  "$schema": "https://json-schema.org/draft/2020-12/schema",
  "$id": "https://aoa.local/Agents-of-Abyss/mechanics/experience/parts/release-deployment/schemas/experience_installation_state_v1.json",
  "title": "Experience Installation State V1",
  "type": "object",
  "additionalProperties": false,
  "required": [
    "allowed_next",
    "created_at",
    "evidence_refs",
    "id",
    "kind",
    "notes",
    "owner_repo",
    "state",
    "status",
    "version"
  ],
  "properties": {
    "allowed_next": {
      "type": "array",
      "items": {
        "type": "string",
        "minLength": 1
      },
      "minItems": 1
    },
    "created_at": {
      "type": "string",
      "minLength": 1,
      "format": "date-time"
    },
    "evidence_refs": {
      "type": "array",
      "items": {
        "type": "string",
        "minLength": 1
      },
      "minItems": 1
    },
    "id": {
      "type": "string",
      "minLength": 1
    },
    "kind": {
      "type": "string",
      "minLength": 1,
      "const": "experience_installation_state_v1"
    },
    "notes": {
      "type": "string",
      "minLength": 1
    },
    "owner_repo": {
      "type": "string",
      "minLength": 1,
      "const": "Agents-of-Abyss"
    },
    "state": {
      "type": "string",
      "minLength": 1
    },
    "status": {
      "type": "string",
      "minLength": 1,
      "enum": [
        "active",
        "allowed",
        "applied",
        "blocked",
        "completed",
        "draft",
        "failed",
        "held",
        "passed",
        "proposed",
        "rejected",
        "rolled_back",
        "sealed"
      ]
    },
    "version": {
      "type": "string",
      "minLength": 1,
      "const": "1.0.0"
    }
  }
}
