{
  "allowed_next": [
    "operator_review",
    "rollback"
  ],
  "created_at": "2026-04-22T00:00:00Z",
  "evidence_refs": [
    "generated/sovereign_release_clean_flow/release_candidate.json"
  ],
  "id": "experience_installation_state_example",
  "kind": "experience_installation_state_v1",
  "notes": "Example artifact for experience_installation_state_v1.",
  "owner_repo": "Agents-of-Abyss",
  "state": "smoke_passed",
  "status": "draft",
  "version": "1.0.0"
}